{"asset_id":"willicat_tree_pilot_dev_01","asset_version":"1-dev","attempt_id":"DEV_DIAGNOSTIC_tree_5e47090652224f75a183823ebc8581cc","criteria_results":[{"criterion_id":"foliage_led_sway","result":"passed"},{"criterion_id":"no_whole_sprite_scale_pulse","result":"passed"},{"criterion_id":"readable_authored_arc","result":"passed"},{"criterion_id":"seam_perceptually_continuous","result":"passed"}],"evidence":[{"artifact_ref":"canonical/evidence/human_decision_binding.json","evidence_id":"canonical_evidence_human_decision_binding.json","sha256":"e578b1b9392024148357abc06301428b6f821d8d31ed582e1d1e0bdc277d6d00"},{"artifact_ref":"canonical/evidence/pilot_calibration.json","evidence_id":"canonical_evidence_pilot_calibration.json","sha256":"85067db9949ee8d111f51557539a0b79b2e4f62ae4cd1c533bb3a0623d65ca0c"},{"artifact_ref":"canonical/evidence/motion_measurement_recheck.json","evidence_id":"canonical_evidence_motion_measurement_recheck.json","sha256":"f211a62f0446b1b00ab985383105e83cc40c01fa77ebea5006bdae446a67533e"},{"artifact_ref":"evidence/diagnostic_runtime_proof.json","evidence_id":"evidence_diagnostic_runtime_proof.json","sha256":"c9965ef10c559b102e288c3664e52b8b3f7efe2623eb84a8cc5491583bbac5c3"}],"gate":"motion","notes":"Human explicitly approved exact source/motion and this pilot calibration. Conversation evidence is not a production signature.","owner_role":"technical_animator","result":"passed","schema_version":"1","timestamp":"2026-09-30T15:43:14.661006Z"}