{"asset_id":"willicat_tree_pilot_dev_01","asset_version":"1-dev","attempt_id":"DEV_DIAGNOSTIC_tree_5e47090652224f75a183823ebc8581cc","evidence":[{"artifact_ref":"canonical/evidence/canonical_integration_proof.json","evidence_id":"canonical_evidence_canonical_integration_proof.json","sha256":"3d44a99577dc7ee3b9867b7453cc0f5eed641df41a92e71530f32d1f21a718d7"}],"gate":"runtime","notes":"Fresh native Godot proof exercised exact immutable candidate at intended logical res:// paths; no source recompilation or production write.","owner_role":"runtime_validator","result":"passed","schema_version":"1","timestamp":"2026-09-30T15:51:15.331761Z"}